{
  "reportVersion": "1.0",
  "specificationVersion": "1.0",
  "commitSha": "d2abea0213fafb41bab1756ca24121bf7b93b7db",
  "applicationVersion": "1.0.0",
  "overallResult": "blocked",
  "releaseRecommendation": "do-not-release",
  "configuration": {
    "repository": "https://github.com/BastianKindereit/flashCards",
    "branch": "main",
    "isDirty": true,
    "nodeVersion": "v24.11.1",
    "npmVersion": "11.6.2",
    "lockfileSha256": "f10b3b955e1c3a6da67b5104897c59865fbed2ddbf54fd234c08bf72a7f7c575",
    "fsrsVersion": "4.4.1",
    "fsrsParameters": {
      "defaultDesiredRetention": 0.9,
      "retentionBounds": [
        0.7,
        0.97
      ],
      "cohortBounds": [
        5,
        20
      ]
    },
    "migrations": [
      {
        "name": "20261010000000_initial_schema.sql",
        "sha256": "a4d5a80fdf7bd4963b4900a11ca4177a2b5aa8c7f0e64efbe8e3730f190a41cd"
      },
      {
        "name": "20261015000001_deck_cascade_deletion.sql",
        "sha256": "c912ff6496b56b23219267bfc723965a72fdff9e3d3928a11d3a85534cfbbc9e"
      },
      {
        "name": "20261015000002_card_deletion.sql",
        "sha256": "c0ca36c19b3f8a4da44ec4de15d0abe0d90c8f0d73a52d4c7dda7e6ec8f2c7e0"
      }
    ]
  },
  "environments": [
    {
      "name": "Local Verification Environment",
      "type": "host",
      "status": "active",
      "details": {
        "os": "darwin 25.5.0 (arm64)",
        "cpus": "Apple M1",
        "totalRamBytes": 8589934592
      }
    },
    {
      "name": "CI Environment",
      "type": "github-actions",
      "status": "configured",
      "details": {
        "runner": "ubuntu-24.04",
        "workflow": ".github/workflows/verify.yml"
      }
    },
    {
      "name": "Staging Environment",
      "type": "cloud-supabase",
      "status": "blocked",
      "details": {
        "reason": "DEC-004: Staging deployment target pending"
      }
    }
  ],
  "requirements": [
    {
      "requirementId": "ARC-001",
      "priority": "Must",
      "activityId": "VA-ARC-001",
      "result": "Pass",
      "evidence": [
        "tests/unit/inspection/inspection.test.ts",
        "tsconfig.json"
      ]
    },
    {
      "requirementId": "ARC-002",
      "priority": "Must",
      "activityId": "VA-ARC-001",
      "result": "Pass",
      "evidence": [
        "tests/unit/inspection/inspection.test.ts",
        "tsconfig.json"
      ]
    },
    {
      "requirementId": "ARC-003",
      "priority": "Must",
      "activityId": "VA-ARC-001",
      "result": "Pass",
      "evidence": [
        "tests/unit/inspection/inspection.test.ts"
      ]
    },
    {
      "requirementId": "ARC-004",
      "priority": "Must",
      "activityId": "VA-ARC-002",
      "result": "Pass",
      "evidence": [
        "tests/e2e/app.spec.ts",
        "vite.config.ts"
      ]
    },
    {
      "requirementId": "ARC-005",
      "priority": "Must",
      "activityId": "VA-ARC-002",
      "result": "Pass",
      "evidence": [
        "tests/unit/inspection/inspection.test.ts"
      ]
    },
    {
      "requirementId": "ARC-006",
      "priority": "Must",
      "activityId": "VA-ARC-002",
      "result": "Pass",
      "evidence": [
        "tests/components/App.test.tsx",
        "src/App.tsx"
      ]
    },
    {
      "requirementId": "ARC-007",
      "priority": "Must",
      "activityId": "VA-ARC-001",
      "result": "Pass",
      "evidence": [
        "tests/unit/inspection/inspection.test.ts",
        "src/lib/supabase.ts"
      ]
    },
    {
      "requirementId": "ARC-008",
      "priority": "Must",
      "activityId": "VA-ARC-001",
      "result": "Pass",
      "evidence": [
        "tests/unit/inspection/inspection.test.ts",
        "supabase/migrations/20261010000000_initial_schema.sql"
      ]
    },
    {
      "requirementId": "ARC-009",
      "priority": "Must",
      "activityId": "VA-ARC-001",
      "result": "Pass",
      "evidence": [
        "tests/unit/domain/schedulerRequirements.test.ts",
        "src/domain/types.ts"
      ]
    },
    {
      "requirementId": "ARC-010",
      "priority": "Must",
      "activityId": "VA-SCH-001",
      "result": "Pass",
      "evidence": [
        "tests/unit/domain/schedulerRequirements.test.ts",
        "src/domain/clock.ts"
      ]
    },
    {
      "requirementId": "AUT-001",
      "priority": "Must",
      "activityId": "VA-AUT-001",
      "result": "Pass",
      "evidence": [
        "tests/components/App.test.tsx",
        "tests/components/AuthContext.test.tsx",
        "tests/e2e/app.spec.ts",
        "src/context/AuthContext.tsx"
      ]
    },
    {
      "requirementId": "AUT-002",
      "priority": "Must",
      "activityId": "VA-AUT-001",
      "result": "Pass",
      "evidence": [
        "tests/components/App.test.tsx",
        "tests/components/AuthContext.test.tsx",
        "tests/e2e/app.spec.ts",
        "src/context/AuthContext.tsx"
      ]
    },
    {
      "requirementId": "AUT-003",
      "priority": "Must",
      "activityId": "VA-AUT-001",
      "result": "Pass",
      "evidence": [
        "tests/components/AuthContext.test.tsx",
        "src/context/AuthContext.tsx"
      ]
    },
    {
      "requirementId": "AUT-004",
      "priority": "Must",
      "activityId": "VA-AUT-001",
      "result": "Pass",
      "evidence": [
        "tests/components/AuthContext.test.tsx",
        "src/context/AuthContext.tsx"
      ]
    },
    {
      "requirementId": "AUT-005",
      "priority": "Must",
      "activityId": "VA-AUT-001",
      "result": "Pass",
      "evidence": [
        "tests/components/AuthContext.test.tsx",
        "src/context/AuthContext.tsx"
      ]
    },
    {
      "requirementId": "AUT-006",
      "priority": "Must",
      "activityId": "VA-AUT-002",
      "result": "Pass",
      "evidence": [
        "tests/components/AuthContext.test.tsx",
        "src/context/AuthContext.tsx"
      ]
    },
    {
      "requirementId": "AUT-007",
      "priority": "Must",
      "activityId": "VA-AUT-003",
      "result": "Pass",
      "evidence": [
        "tests/components/App.test.tsx",
        "tests/components/AuthContext.test.tsx",
        "src/App.tsx"
      ]
    },
    {
      "requirementId": "AUT-008",
      "priority": "Must",
      "activityId": "VA-AUT-003",
      "result": "Pass",
      "evidence": [
        "tests/components/App.test.tsx",
        "tests/components/AuthContext.test.tsx",
        "src/App.tsx"
      ]
    },
    {
      "requirementId": "AUT-009",
      "priority": "Must",
      "activityId": "VA-AUT-003",
      "result": "Pass",
      "evidence": [
        "tests/components/AuthContext.test.tsx",
        "src/context/AuthContext.tsx"
      ]
    },
    {
      "requirementId": "DEK-001",
      "priority": "Must",
      "activityId": "VA-DEK-001",
      "result": "Pass",
      "evidence": [
        "tests/components/App.test.tsx",
        "tests/components/DeckModals.test.tsx",
        "src/components/DeckModal.tsx"
      ]
    },
    {
      "requirementId": "DEK-002",
      "priority": "Must",
      "activityId": "VA-DEK-001",
      "result": "Pass",
      "evidence": [
        "tests/components/App.test.tsx",
        "tests/components/DeckModals.test.tsx",
        "src/components/DeckModal.tsx"
      ]
    },
    {
      "requirementId": "DEK-003",
      "priority": "Must",
      "activityId": "VA-DEK-001",
      "result": "Pass",
      "evidence": [
        "tests/database/schema.test.ts",
        "src/components/DeckModal.tsx",
        "tests/components/DeckModals.test.tsx"
      ]
    },
    {
      "requirementId": "DEK-004",
      "priority": "Must",
      "activityId": "VA-DEK-001",
      "result": "Pass",
      "evidence": [
        "tests/database/schema.test.ts",
        "src/components/DeckModal.tsx",
        "tests/components/DeckModals.test.tsx"
      ]
    },
    {
      "requirementId": "DEK-005",
      "priority": "Must",
      "activityId": "VA-DEK-001",
      "result": "Pass",
      "evidence": [
        "tests/database/schema.test.ts",
        "src/components/DeckModal.tsx",
        "tests/components/DeckModals.test.tsx"
      ]
    },
    {
      "requirementId": "DEK-006",
      "priority": "Must",
      "activityId": "VA-DEK-001",
      "result": "Pass",
      "evidence": [
        "tests/database/schema.test.ts",
        "src/components/DeckModal.tsx",
        "tests/components/DeckModals.test.tsx"
      ]
    },
    {
      "requirementId": "DEK-007",
      "priority": "Must",
      "activityId": "VA-DEK-001",
      "result": "Pass",
      "evidence": [
        "tests/database/schema.test.ts",
        "src/components/DeckModal.tsx",
        "tests/components/DeckModals.test.tsx"
      ]
    },
    {
      "requirementId": "DEK-008",
      "priority": "Must",
      "activityId": "VA-DEK-001",
      "result": "Pass",
      "evidence": [
        "tests/database/schema.test.ts",
        "src/components/DeckModal.tsx",
        "tests/components/DeckModals.test.tsx"
      ]
    },
    {
      "requirementId": "DEK-009",
      "priority": "Must",
      "activityId": "VA-DEK-001",
      "result": "Pass",
      "evidence": [
        "tests/components/DeckModals.test.tsx",
        "src/components/DeckModal.tsx"
      ]
    },
    {
      "requirementId": "DAT-001",
      "priority": "Must",
      "activityId": "VA-DAT-001",
      "result": "Pass",
      "evidence": [
        "tests/database/schema.test.ts",
        "supabase/tests/database/initial_schema.test.sql",
        "supabase/migrations/20261010000000_initial_schema.sql"
      ]
    },
    {
      "requirementId": "DAT-002",
      "priority": "Must",
      "activityId": "VA-DAT-001",
      "result": "Pass",
      "evidence": [
        "tests/database/schema.test.ts",
        "supabase/migrations/20261010000000_initial_schema.sql"
      ]
    },
    {
      "requirementId": "DAT-003",
      "priority": "Must",
      "activityId": "VA-DAT-001",
      "result": "Pass",
      "evidence": [
        "tests/database/schema.test.ts",